{
  "version": "1.0",
  "artifact_type": "health_check",
  "artifact_id": "health-check-2026-04-10T12-52-50Z",
  "producer_type": "orchestration-authority",
  "signals": [
    {
      "name": "memory_bloat",
      "value": 0,
      "threshold": 0.4,
      "triggered": false,
      "detail": "v4 memory model uses simplified 2-state agent notes"
    },
    {
      "name": "review_gap",
      "value": 0,
      "threshold": 0.2,
      "triggered": false,
      "detail": "No completed tasks to review"
    },
    {
      "name": "gate_quality_issue",
      "value": 0,
      "threshold": 0.3,
      "triggered": false,
      "detail": "No mission directory"
    },
    {
      "name": "contradiction_accumulation",
      "value": 0,
      "threshold": 3,
      "triggered": false,
      "detail": "v4 memory model has no structured contradiction tracking"
    },
    {
      "name": "repeated_failure_class",
      "value": 0,
      "threshold": 2,
      "triggered": false,
      "detail": "0 tasks had 2+ gate failures"
    },
    {
      "name": "debt_stagnation",
      "value": 0,
      "threshold": 5,
      "triggered": false,
      "detail": "No debt register found"
    },
    {
      "name": "scope_control_weakness",
      "value": 0,
      "threshold": 2,
      "triggered": false,
      "detail": "0/0 tasks have weak or missing scope"
    },
    {
      "name": "worker_low_confidence",
      "value": 0,
      "threshold": 2,
      "triggered": false,
      "detail": "0 self-checks with confidence <= 2"
    }
  ],
  "any_triggered": false,
  "trigger_context": "manual",
  "created_at": "2026-04-10T12:52:50Z"
}
